{"$schema":"https://json-schema.org/draft/2020-12/schema","title":"municipios","type":"object","properties":{"divipola":{"type":"string"},"nombre":{"type":"string"},"departamento":{"type":"string"},"codigo_depto":{"type":"string"},"lat":{"type":["number","null"]},"lng":{"type":["number","null"]},"sisben_pob_total":{"type":["number","null"]},"sisben_pob_vulnerable":{"type":["number","null"]}},"required":["divipola","nombre","departamento"]}
