[
  {
    "divipola": "19022",
    "nombre": "Almaguer",
    "departamento": "Cauca",
    "codigo_depto": "19",
    "lat": 2.45,
    "lng": -76.61,
    "sisben_pob_vulnerable": 12961
  },
  {
    "divipola": "19050",
    "nombre": "Argelia",
    "departamento": "Cauca",
    "codigo_depto": "19",
    "lat": 2.45,
    "lng": -76.61,
    "sisben_pob_vulnerable": 22785
  },
  {
    "divipola": "19075",
    "nombre": "Balboa",
    "departamento": "Cauca",
    "codigo_depto": "19",
    "lat": 2.45,
    "lng": -76.61,
    "sisben_pob_vulnerable": 16658
  },
  {
    "divipola": "19100",
    "nombre": "Bolívar",
    "departamento": "Cauca",
    "codigo_depto": "19",
    "lat": 1.8367,
    "lng": -76.9667,
    "sisben_pob_vulnerable": 30647
  },
  {
    "divipola": "19110",
    "nombre": "Buenos Aires",
    "departamento": "Cauca",
    "codigo_depto": "19",
    "lat": 2.45,
    "lng": -76.61,
    "sisben_pob_vulnerable": 14326
  },
  {
    "divipola": "19130",
    "nombre": "Cajibío",
    "departamento": "Cauca",
    "codigo_depto": "19",
    "lat": 2.45,
    "lng": -76.61,
    "sisben_pob_vulnerable": 25892
  },
  {
    "divipola": "19137",
    "nombre": "Caldono",
    "departamento": "Cauca",
    "codigo_depto": "19",
    "lat": 2.45,
    "lng": -76.61,
    "sisben_pob_vulnerable": 8032
  },
  {
    "divipola": "19142",
    "nombre": "Caloto",
    "departamento": "Cauca",
    "codigo_depto": "19",
    "lat": 3.0367,
    "lng": -76.4083,
    "sisben_pob_vulnerable": 10320
  },
  {
    "divipola": "19212",
    "nombre": "Corinto",
    "departamento": "Cauca",
    "codigo_depto": "19",
    "lat": 2.45,
    "lng": -76.61,
    "sisben_pob_vulnerable": 12191
  },
  {
    "divipola": "19256",
    "nombre": "El Tambo",
    "departamento": "Cauca",
    "codigo_depto": "19",
    "lat": 2.4517,
    "lng": -76.8147,
    "sisben_pob_vulnerable": 27560
  },
  {
    "divipola": "19290",
    "nombre": "Florencia",
    "departamento": "Cauca",
    "codigo_depto": "19",
    "lat": 2.45,
    "lng": -76.61,
    "sisben_pob_vulnerable": 4581
  },
  {
    "divipola": "19300",
    "nombre": "Guapi",
    "departamento": "Cauca",
    "codigo_depto": "19",
    "lat": 2.5726,
    "lng": -77.8923,
    "sisben_pob_vulnerable": 15573
  },
  {
    "divipola": "19318",
    "nombre": "Inzá",
    "departamento": "Cauca",
    "codigo_depto": "19",
    "lat": 2.45,
    "lng": -76.61,
    "sisben_pob_vulnerable": 17470
  },
  {
    "divipola": "19355",
    "nombre": "Jambaló",
    "departamento": "Cauca",
    "codigo_depto": "19",
    "lat": 2.45,
    "lng": -76.61,
    "sisben_pob_vulnerable": 11611
  },
  {
    "divipola": "19364",
    "nombre": "La Sierra",
    "departamento": "Cauca",
    "codigo_depto": "19",
    "lat": 2.45,
    "lng": -76.61,
    "sisben_pob_vulnerable": null
  },
  {
    "divipola": "19392",
    "nombre": "La Vega",
    "departamento": "Cauca",
    "codigo_depto": "19",
    "lat": 2.45,
    "lng": -76.61,
    "sisben_pob_vulnerable": 8413
  },
  {
    "divipola": "19397",
    "nombre": "López de Micay",
    "departamento": "Cauca",
    "codigo_depto": "19",
    "lat": 2.45,
    "lng": -76.61,
    "sisben_pob_vulnerable": 10901
  },
  {
    "divipola": "19418",
    "nombre": "Mercaderes",
    "departamento": "Cauca",
    "codigo_depto": "19",
    "lat": 2.45,
    "lng": -76.61,
    "sisben_pob_vulnerable": 4030
  },
  {
    "divipola": "19450",
    "nombre": "Miranda",
    "departamento": "Cauca",
    "codigo_depto": "19",
    "lat": 2.45,
    "lng": -76.61,
    "sisben_pob_vulnerable": 11651
  },
  {
    "divipola": "19455",
    "nombre": "Morales",
    "departamento": "Cauca",
    "codigo_depto": "19",
    "lat": 2.45,
    "lng": -76.61,
    "sisben_pob_vulnerable": 16936
  },
  {
    "divipola": "19473",
    "nombre": "Padilla",
    "departamento": "Cauca",
    "codigo_depto": "19",
    "lat": 2.45,
    "lng": -76.61,
    "sisben_pob_vulnerable": 13085
  },
  {
    "divipola": "19872",
    "nombre": "Páez",
    "departamento": "Cauca",
    "codigo_depto": "19",
    "lat": 2.45,
    "lng": -76.61,
    "sisben_pob_vulnerable": null
  },
  {
    "divipola": "19513",
    "nombre": "Patía",
    "departamento": "Cauca",
    "codigo_depto": "19",
    "lat": 2.45,
    "lng": -76.61,
    "sisben_pob_vulnerable": 6259
  },
  {
    "divipola": "19517",
    "nombre": "Piamonte",
    "departamento": "Cauca",
    "codigo_depto": "19",
    "lat": 2.45,
    "lng": -76.61,
    "sisben_pob_vulnerable": 5284
  },
  {
    "divipola": "19532",
    "nombre": "Piendamó",
    "departamento": "Cauca",
    "codigo_depto": "19",
    "lat": 2.45,
    "lng": -76.61,
    "sisben_pob_vulnerable": 22548
  },
  {
    "divipola": "19533",
    "nombre": "Piendamó - Tunia",
    "departamento": "Cauca",
    "codigo_depto": "19",
    "lat": 2.1158,
    "lng": -77.0578,
    "sisben_pob_vulnerable": 7158
  },
  {
    "divipola": "19001",
    "nombre": "Popayán",
    "departamento": "Cauca",
    "codigo_depto": "19",
    "lat": 2.4448,
    "lng": -76.6147,
    "sisben_pob_vulnerable": 151016
  },
  {
    "divipola": "19548",
    "nombre": "Puerto Tejada",
    "departamento": "Cauca",
    "codigo_depto": "19",
    "lat": 2.45,
    "lng": -76.61,
    "sisben_pob_vulnerable": 24943
  },
  {
    "divipola": "19573",
    "nombre": "Puracé",
    "departamento": "Cauca",
    "codigo_depto": "19",
    "lat": 3.2342,
    "lng": -76.4108,
    "sisben_pob_vulnerable": 15305
  },
  {
    "divipola": "19585",
    "nombre": "Rosas",
    "departamento": "Cauca",
    "codigo_depto": "19",
    "lat": 2.45,
    "lng": -76.61,
    "sisben_pob_vulnerable": 4700
  },
  {
    "divipola": "19622",
    "nombre": "San Sebastián",
    "departamento": "Cauca",
    "codigo_depto": "19",
    "lat": 2.45,
    "lng": -76.61,
    "sisben_pob_vulnerable": 9016
  },
  {
    "divipola": "19693",
    "nombre": "Santa Rosa",
    "departamento": "Cauca",
    "codigo_depto": "19",
    "lat": 2.45,
    "lng": -76.61,
    "sisben_pob_vulnerable": 4776
  },
  {
    "divipola": "19698",
    "nombre": "Santander de Quilichao",
    "departamento": "Cauca",
    "codigo_depto": "19",
    "lat": 2.6214,
    "lng": -76.5294,
    "sisben_pob_vulnerable": 45496
  },
  {
    "divipola": "19701",
    "nombre": "Silvia",
    "departamento": "Cauca",
    "codigo_depto": "19",
    "lat": 3.0103,
    "lng": -76.4858,
    "sisben_pob_vulnerable": 3465
  },
  {
    "divipola": "19743",
    "nombre": "Sotará",
    "departamento": "Cauca",
    "codigo_depto": "19",
    "lat": 2.3978,
    "lng": -76.6019,
    "sisben_pob_vulnerable": 3266
  },
  {
    "divipola": "19760",
    "nombre": "Suárez",
    "departamento": "Cauca",
    "codigo_depto": "19",
    "lat": 2.0528,
    "lng": -76.6314,
    "sisben_pob_vulnerable": 6660
  },
  {
    "divipola": "19780",
    "nombre": "Sucre",
    "departamento": "Cauca",
    "codigo_depto": "19",
    "lat": 2.45,
    "lng": -76.61,
    "sisben_pob_vulnerable": 13668
  },
  {
    "divipola": "19785",
    "nombre": "Timbío",
    "departamento": "Cauca",
    "codigo_depto": "19",
    "lat": 2.45,
    "lng": -76.61,
    "sisben_pob_vulnerable": 6006
  },
  {
    "divipola": "19807",
    "nombre": "Timbiquí",
    "departamento": "Cauca",
    "codigo_depto": "19",
    "lat": 2.45,
    "lng": -76.61,
    "sisben_pob_vulnerable": 24490
  },
  {
    "divipola": "19809",
    "nombre": "Toribío",
    "departamento": "Cauca",
    "codigo_depto": "19",
    "lat": 2.45,
    "lng": -76.61,
    "sisben_pob_vulnerable": 13839
  },
  {
    "divipola": "19821",
    "nombre": "Totoró",
    "departamento": "Cauca",
    "codigo_depto": "19",
    "lat": 1.7222,
    "lng": -76.7233,
    "sisben_pob_vulnerable": null
  },
  {
    "divipola": "19845",
    "nombre": "Villa Rica",
    "departamento": "Cauca",
    "codigo_depto": "19",
    "lat": 2.45,
    "lng": -76.61,
    "sisben_pob_vulnerable": 15138
  },
  {
    "divipola": "27006",
    "nombre": "Acandí",
    "departamento": "Chocó",
    "codigo_depto": "27",
    "lat": 8.5147,
    "lng": -77.2783,
    "sisben_pob_vulnerable": 9341
  },
  {
    "divipola": "27025",
    "nombre": "Alto Baudó",
    "departamento": "Chocó",
    "codigo_depto": "27",
    "lat": 5.69,
    "lng": -76.66,
    "sisben_pob_vulnerable": 12526
  },
  {
    "divipola": "27050",
    "nombre": "Atrato",
    "departamento": "Chocó",
    "codigo_depto": "27",
    "lat": 4.6667,
    "lng": -76.7,
    "sisben_pob_vulnerable": 4414
  },
  {
    "divipola": "27073",
    "nombre": "Bagadó",
    "departamento": "Chocó",
    "codigo_depto": "27",
    "lat": 5.69,
    "lng": -76.66,
    "sisben_pob_vulnerable": 2715
  },
  {
    "divipola": "27075",
    "nombre": "Bahía Solano",
    "departamento": "Chocó",
    "codigo_depto": "27",
    "lat": 5.69,
    "lng": -76.66,
    "sisben_pob_vulnerable": 6936
  },
  {
    "divipola": "27077",
    "nombre": "Bajo Baudó",
    "departamento": "Chocó",
    "codigo_depto": "27",
    "lat": 6.2261,
    "lng": -77.4011,
    "sisben_pob_vulnerable": 13225
  },
  {
    "divipola": "27099",
    "nombre": "Bojayá",
    "departamento": "Chocó",
    "codigo_depto": "27",
    "lat": 5.69,
    "lng": -76.66,
    "sisben_pob_vulnerable": 10720
  },
  {
    "divipola": "27135",
    "nombre": "Carmen del Darién",
    "departamento": "Chocó",
    "codigo_depto": "27",
    "lat": 5.0933,
    "lng": -76.6458,
    "sisben_pob_vulnerable": 4089
  },
  {
    "divipola": "27150",
    "nombre": "Cértegui",
    "departamento": "Chocó",
    "codigo_depto": "27",
    "lat": 5.69,
    "lng": -76.66,
    "sisben_pob_vulnerable": 8474
  },
  {
    "divipola": "27160",
    "nombre": "Condoto",
    "departamento": "Chocó",
    "codigo_depto": "27",
    "lat": 6.1858,
    "lng": -77.3572,
    "sisben_pob_vulnerable": 3361
  },
  {
    "divipola": "27205",
    "nombre": "El Cantón del San Pablo",
    "departamento": "Chocó",
    "codigo_depto": "27",
    "lat": 5.69,
    "lng": -76.66,
    "sisben_pob_vulnerable": 7838
  },
  {
    "divipola": "27245",
    "nombre": "El Carmen de Atrato",